{
  "schema_version": 1,
  "provider": "agents-generic",
  "output_root": "agents-generic",
  "artifacts": {
    "instruction": {"status": "supported", "output_template": "instructions/{alias}.md", "transform": "copy"},
    "skill": {"status": "supported", "output_template": "skills/{alias}/SKILL.md", "transform": "copy"},
    "command": {"status": "unsupported", "output_template": null, "transform": "none"},
    "agent": {"status": "unsupported", "output_template": null, "transform": "none"},
    "mcp": {"status": "unsupported", "output_template": null, "transform": "none"},
    "hook": {"status": "unsupported", "output_template": null, "transform": "none"}
  }
}
